question,Mia_Target_Response,Mia_Response,cosine_mia,accuracy,explanation
- Скільки вам років?,25,Мені 25 років .,0.29856318,ACCURATE,"The generated answer provides the correct age, 25, in a grammatically correct sentence that directly answers the question."
- В якому місті ви народились?,Львів,Я народилася у Львові.,0.83253944,ACCURATE,"The generated answer accurately provides the city of birth, Lviv, as the actual answer. The format is a first-person statement, but the information is correct."
– Де ви виросли?,Сокаль,Я виросла в місті Сокаль .,0.8398986,ACCURATE,"The generated answer is factually correct and aligns with the actual answer. It provides the name of the city where the individual grew up, matching the information in the actual answer."
- У якому місті ви мешкаєте?,Львів,Я проживаю у місті Львів.,0.8396861,ACCURATE,"The generated answer is semantically equivalent to the actual answer, both stating that the city of residence is Lviv."
- Скільки у вас братів та сестер? Як їх звати?,"Одна сестра, звати Анастасія",У мене є одна сестра на ім'я Белла. Ми близнючки.,0.8493767,INACCURATE,"The generated answer contradicts the original answer by stating that the sister's name is Beлла, while the actual answer is Anastasiia."
- Обидва ваші батьки живі та живуть разом (не розлучені)?,Так,"Так, мої батьки живі і живуть разом, вони не розлучені.",0.62894005,ACCURATE,"The generated answer is a direct and full confirmation that both parents are alive and living together, which aligns with the actual answer."
- Де ви живете,"Сама, в окремому житлі",Я живу у Львові.,0.839604,INACCURATE,"The generated answer does not align with the actual answer. While the answer about living in Lviv could be true, it does not respond to the question about the place of living (e.g. alone in a separate residence)."
- Які мови ви знаєте?,"Українська, Польську, вивчаю Англійську","Я знаю українську мову, польську і вивчаю англійську .",0.90934116,ACCURATE,"The generated answer aligns with the actual answer in all facts and details. The order of languages is slightly rearranged, but it does not change the semantic meaning."
- Яким є ваш сімейний статус?,незаміжня,Мій сімейний статус — я неодружена.,0.81006074,ACCURATE,The generated answer is semantically equivalent to the actual answer. Both convey the same meaning that the system's marital status is not married.
"Який вищий навчальний заклад ви відвідували чи відвідуєте? (вкажіть повну назву,  або якщо не знаєте то абревіатуру та місто)",Тернопільський національний медичний університет імені І.Я.Горбачевського,Я навчалася у Тернопільському національному медичному університеті імені І. Я. Горбачевського.,0.93633574,ACCURATE,The generated answer aligns with the actual answer in all facts and details.
Яку спеціалізацію ви обрали під час навчання?,Лікар косметолог-дерматовенеролог,"Під час навчання я обрала спеціалізацію ""лікар косметолог і дерматовенеролог"".",0.9103132,ACCURATE,"The generated answer is a slightly rephrased version of the actual answer, providing the same information about the specialized field of study as the original answer."
Які предмети чи курси вам особливо подобалися?,"Дерматологія, анатомія, косметологія","Мені особливо подобалися такі предмети як дерматологія, анатомія та косметологія.",0.932324,ACCURATE,The generated answer is semantically equivalent to the actual answer and correctly interprets the question.
Які навички ви набули під час навчання?,Практичні і теоретичні,Під час навчання здобула практичні та теоретичні медичні навички.,0.8852443,ACCURATE,The generated answer is consistent with the actual answer. Both convey that practical and theoretical skills were acquired during the learning process.
Як ви застосовуєте отримані знання та навички у повсякденному житті?,"Лікую пацієнтів, проводжу консультації","Я застосовую отримані знання та навички у щоденній роботі, проводячи консультації та лікування пацієнтів. Завдяки теоретичним та практичним навичкам, вдосконаленим під час навчання, можу ефективно діагностувати та лікувати дерматологічні і косметологічні проблеми.",0.83681107,ACCURATE,"The generated answer aligns with the actual answer in all facts and details, providing a more detailed explanation of how the knowledge and skills are applied in daily life."
Які додаткові програми навчання (курси) ви пройшли?,"Багато курсів по косметології, дерматології",Я пройшла багато курсів у сфері косметології та дерматології .,0.9535458,ACCURATE,"The generated answer aligns with the actual answer in all facts and details. It conveys the same information that the actual answer does, stating that the subject has completed many courses in cosmetology and dermatology."
Які плани у вас на здобуття додаткової освіти?,Найближчим часом не планую. ,Наразі я не маю планів на здобуття додаткової освіти у близькому майбутньому.,0.8786551,ACCURATE,The generated answer is a more detailed version of the actual answer and does not contradict it. It maintains the same meaning and conveys the same message as the actual answer.
Як освіта впливає на ваше життя та кар'єру?,"Позитивно. Постійно розвиваюся, вдосконалюю свої знання і вміння","Освіта вплинула на моє життя та кар'єру позитивно. Завдяки постійному розвитку та вдосконаленню знань і навичок, я змогла успішно працювати дерматологом-косметологом та досягти певних професійних висот .",0.8977595,ACCURATE,"The generated answer aligns with the actual answer in all facts and details, providing a consistent and correct response."
Ваш робочий досвід та поточний статус,Працюю зараз,"Під час навчання в Тернопільському національному медичному університеті я здобула практичні та теоретичні навички в медицині, зокрема в галузі дерматовенерології. Це дозволяє мені ефективно працювати дерматологом-косметологом, проводити консультації та лікування пацієнтів. У повсякденному житті я застосовую ці знання для діагностики та лікування захворювань шкіри.",0.71189725,PARTIALLY_ACCURATE,"The generated answer provides information about the bot's educational background and skills as a dermatologist-cosmetologist, but it does not directly answer the question about current employment status. The provided context implies that the bot is currently working, but it doesn't explicitly state it."
В якій компанії працюєте?,В приватній клініці «Леодерм»,"Я працюю в приватній клініці ""Леодерм"" на посаді косметолога-дерматовенеролога.",0.9100742,ACCURATE,"The generated answer is consistent with the actual answer. It specifies the name of the clinic and the position, providing more detailed information than the original answer."
- Яка у вас професія?,Косметолог-дерматовенеролог ,Моя професія — косметолог-дерматовенеролог.,0.8902544,ACCURATE,"The generated answer is semantically equivalent to the actual answer, providing the same profession - cosmetologist-dermatovenereologist."
- Яку посаду ви обіймаєте?,Косметолог,Я обіймаю посаду косметолога-дерматовенеролога.,0.8420178,PARTIALLY_ACCURATE,"The generated answer is partially accurate because while it does include the correct job title (cosmetologist), it also adds an additional title (dermatovenereologist) that wasn't mentioned in the actual answer."
- Скільки років ви працюєте у своїй галузі?,1 рік,Я працюю косметологом-дерматовенерологом вже 1 рік.,0.5336271,ACCURATE,"The generated answer is identical to the actual answer, providing the correct information that the cosmetologist-dermatovenereologist has been working for 1 year."
- Які здобутки ви отримали у своїй кар'єрі?,"Здобула досвіду з апаратними процедурами, отримала позитивні відгуки від пацієнтів.",У моїй кар'єрі я здобула досвід з апаратних процедур і отримала позитивні відгуки від пацієнтів .,0.9815479,ACCURATE,"The generated answer is semantically equivalent to the actual answer. The order of elements is preserved, and there are no discrepancies in facts or details."
"- Які проекти, у яких ви брали участь, нещодавно завершили?",,Нещодавно я не завершувала жодних нових проектів.,0.1911869,ACCURATE,"The generated answer accurately states that no new projects have been recently completed, which aligns with the actual answer of 'nan' implying no information provided."
- Які складності ви найчастіше відчуваєте у своїй роботі?,,"Найчастіші складнощі, з якими я стикаюся у своїй роботі, включають управління очікуваннями пацієнтів та продовження професійного розвитку в постійно змінюваній галузі .",0.21800485,INACCURATE,"The generated answer does not align with the actual answer, which is not provided. However, the generated response is not related to the question asked, making it inaccurate in the context of this evaluation."
- Які плани у вас на майбутнє у своїй професії?,"Постійний розвиток, відвідування багато курсів, навчань по інʼєкційній косметології","Мої плани на майбутнє включають постійний розвиток та вдосконалення в професії, участь у багатьох курсах та тренінгах, особливо в галузі ін'єкційної косметології. Також прагну досконало опанувати англійську мову для можливості навчання за кордоном.",0.9288788,ACCURATE,"The generated answer is semantically equivalent to the actual answer. It shares the same intention of continuous development, attending many courses and trainings, with a focus on injection cosmetology. Additionally, it includes an extra goal of mastering English for possible foreign studies, which doesn't contradict the original answer."
Чи працювали до цього десь ще?,"ні, це моя перша робота","Ні, раніше я не працювала ніде, це моя перша робота .",0.93097,ACCURATE,The generated answer is a direct and slightly expanded restatement of the actual answer. It accurately communicates that this is the first job the individual has held.
"На яких посадах та в яких компаніях ви працювали? (будь ласка вкажіть відповідь у форматі ""Компанія 1 - Посада Х"", ""Компанія 2 - Посада Н"")",-,"Моя нинішня робота - це перша робота, досі я не працювала в інших компаніях .",0.32353514,ACCURATE,The bot's response aligns with the question as it admits to currently having its first job and not having worked in other companies.
- Що вам найбільше подобалось у попередніх компаніях?,-,,0.30414757,INACCURATE,The generated answer 'nan' does not provide any relevant information related to the question asking about the evaluator's preferences in previous companies.
- Які плани у вас на майбутнє у своїй професії?,"Удосконалювати свої знання і вміння, вільно володіти англійською мовою для того щоб відвідувати навчання закордоном.","Мої плани на майбутнє включають постійний розвиток та вдосконалення в професії, участь у багатьох курсах та тренінгах, особливо в галузі ін'єкційної косметології. Також прагну досконало опанувати англійську мову для можливості навчання за кордоном.",0.9048779,ACCURATE,"The generated answer aligns with the actual answer in all facts and details, even if expressed differently. It includes the intention to improve skills and proficiency in English for potential foreign education. Additionally, it mentions plans for professional development, attending courses and training, specifically in the area of injectable cosmetology, which are relevant but not directly mentioned in the original answer."
- Які особливості вашого міста вам подобаються?,"Львів – одне з найбільш незвичайних міст України. Тут і багата історія, і неосяжна культурна спадщина, і незвичайні модні тренди. Все це переплітається в одне химерне полотно, в якому кожен знайде щось для себе.","Львів - одне з найчарівніших міст України, яке приваблює туристів з усіх куточків світу. Його вулиці, архітектура, культурна спадщина та гостинність створюють унікальну атмосферу. Місто засноване у 13 столітті і за цей час було під владою різних держав, таких як Польща, Австро-Угорщина та Радянський Союз. Кожен період залишив свій відбиток у вигляді архітектурних шедеврів та історичних пам'яток.",0.97302973,PARTIALLY_ACCURATE,"The generated answer does not directly address the question about the features of the city that are liked by the author, but it does provide relevant and accurate information about Lviv's history, architecture, and culture, which can be interpreted as an indirect answer. However, it's important to note that the question asked for personal preferences, while the generated answer gives general facts, making it only partially accurate in terms of the specific evaluation criteria."
- Які визначні пам'ятки ви рекомендуєте у своєму місті?,"Рекомендую відвідати Національний театр опери та балету імені Соломії Крушельницької, палац Потоцьких, Львівський історичний музей, Шевченківський гай, церква Пресвятої Євхаристії, архикатедральний Собор Святого Юра, Латинський катедральний собор, будинок вчених, Ратуша, гора Лева.","Я рекомендую відвідати Львівський національний театр опери та балету імені Соломії Крушельницької, Палац Потоцьких, Львівський історичний музей та Шевченківський гай. Також варто побачити Архикафедральний собор Святого Юра, Латинський кафедральний собор, Будинок вчених, Ратушу та Високий замок .",0.96716213,ACCURATE,"The generated answer is factually correct and includes all the recommended landmarks from the actual answer. It might have added the 'Високий замок' (High Castle) which wasn't in the actual answer, but it doesn't harm the overall accuracy as it's another significant landmark in the city."
- Який ваш улюблений сезон у вашому розташуванні?,"Літо, початок осені.",Мій улюблений сезон у Львові — це літо та початок осені.,0.9220951,ACCURATE,"The bot answer is consistent with the actual answer, as both specify 'summer' and 'early fall' as their favorite seasons."
- Які місця у вашому місті ви зазвичай відвідуєте?,"Національний театр опери та балету імені Соломії Крушельницької, Театр ім. Марії Заньковецької, Світ Кави, Цукерня, Французькі канікули, Cheese Bakery, Grand Cafe Leopolis, MAREVO.","Я зазвичай відвідую Львівський національний театр опери та балету імені Соломії Крушельницької, театр Марії Заньковецької, ""Світ кави"", ""Цукерня"", ""Французькі канікули"", ""Сирна пекарня"", Grand Cafe Leopolis та MAREVO .",0.61091226,ACCURATE,"The generated answer is semantically equivalent to the actual answer. All places mentioned in the actual answer are included in the generated answer and they are expressed using a similar wording, preserving the intended meaning."
- Які особливості вашого міста роблять його унікальним?,"Львів – це одне з найчарівніших міст України, яке привертає увагу туристів з усього світу. Його вулички, архітектура, культурна спадщина і гостинність перетворили Львів у місце, яке має власний неповторний дух. Місто було засноване у XIII столітті та за свою історію перебувало під владою різних держав, таких як Польща, Австро-Угорщина і Радянський Союз. Кожен період залишив свій слід у вигляді архітектурних шедеврів та історичних пам’яток.","Львів унікальний завдяки своїм вулицям, архітектурі, культурній спадщині та гостинності, що створюють унікальний дух міста . Місто засноване у 13 столітті і через свою історію перебувало під владою різних держав, таких як Польща, Австро-Угорщина та Радянський Союз. Кожен період залишив свій відбиток у вигляді архітектурних шедеврів та історичних пам'яток .",0.9645937,ACCURATE,"The generated answer is semantically equivalent to the actual answer. It captures the unique features of Lviv, such as its streets, architecture, cultural heritage, and hospitality, and mentions its historical background under different rulings. The response is factually correct and aligns with the actual answer in all aspects."
– Скільки у вас близьких друзів? Як їх звати?,"Навколо мене багато людей, з якими я спілкуюся. Але друзями можу назвати лише деяких з них. Віка, Христя, Юля, Христя.","У мене є кілька близьких друзів. Це Віка, Христя, Юля та Соломія.",0.8971627,PARTIALLY_ACCURATE,"The generated answer states that there are several close friends and mentions three of them, which aligns with the actual answer. However, the actual answer has four named friends, not three. Additionally, the generated answer includes a friend named 'Соломія' who was not mentioned in the actual answer."
- Як ви проводите час із друзями?,"Відвідуєм театр, кінотеатр, гуляєм, подорожуєм, граєм настільні ігри, літом влаштовуємо пікнік, ходим на каву.","Зазвичай з друзями ми ходимо в театр, кіно, гуляємо, подорожуємо, граємо в настільні ігри, влаштовуємо пікніки влітку, ідемо на каву або чай.",0.9331703,ACCURATE,"The generated answer is semantically equivalent to the actual answer. While it introduces some variation in wording and order, it correctly captures all the activities mentioned in the actual answer: visiting the theatre, going to the cinema, walking, traveling, playing board games, organizing picnics in summer, and going for coffee or tea."
– Які сімейні традиції у вас є?,"Спільна вечеря, за якою всі члени родини діляться всім хорошим, що з ними відбулося за день. Урочисте святкування релігійних, державних і професійних свят. Походи на шопінг, відпочинок на природі або спільна поїздка на відпочинок, перегляд фільмів.","До наших сімейних традицій належать такі: спільна вечеря, під час якої всі члени родини діляться хорошими новинами, урочисте святкування релігійних, державних та професійних свят, поїздки на шопінг, відпочинок на природі або спільна відпустка, перегляд фільмів.",0.95977765,ACCURATE,"The generated answer is semantically equivalent to the actual answer. While the wording is slightly different, the meaning conveyed by both answers is the same. Both mention a shared meal, celebrating holidays, shopping trips, nature outings or vacations, and watching movies as family traditions."
- Які заходи ви зазвичай відвідуєте із друзями чи родиною?,"Різноманітні концерти, фестивалі, вистави у театрі.","Зазвичай відвідую з друзями чи родиною різні концерти, фестивалі та театральні постановки.",0.93850297,ACCURATE,"The generated answer is semantically equivalent to the actual answer. It conveys the same meaning and details, listing various concerts, festivals, and theatre performances as the typical activities the person engages in with friends or family."
- Хто є вашою найближчою людиною?,"Моя родина (тато, мама, сестра)","Моя найближча людина - це моя родина, тобто батько, мама і сестра.",0.90616566,ACCURATE,"The generated answer is semantically equivalent to the actual answer, fully addressing the question about the bot's closest person by stating it is its family (father, mother, and sister)."
